name,bio,linkName,linkUrl,monthlyListeners,worldRank,L0_city,L0_country,L0_numberOfListeners,L0_region,L1_city,L1_country,L1_numberOfListeners,L1_region,L2_city,L2_country,L2_numberOfListeners,L2_region,L3_city,L3_country,L3_numberOfListeners,L3_region,L4_city,L4_country,L4_numberOfListeners,L4_region
Bizarrap,"BIZARRAP (BZRP) es un artista y productor musical. El artista argentino más escuchado a nivel global en 2020 es referente de la nueva escena de la música latina. Obtuvo 4 nominaciones a los Latin Grammy 2021 incluyendo &#34;Productor del año&#34; y &#34;Mejor Nuevo Artista&#34;.
 
BIZARRAP (BZRP) is an artist and producer. He is the most streamed Argentine artist globally in 2020 and has become an icon of the new hispanic music scene. He has recently received four Latin nominations including &#34;Best Producer &#34;and &#34;Best New Artist&#34;",INSTAGRAM,https://instagram.com/bizarrap,33774836,69,Mexico City,MX,2224632,CMX,Santiago,CL,1711343,RM,Buenos Aires,AR,1644201,C,Madrid,ES,1630133,M,Lima,PE,1062038,LMA
Duki,FUCK DAT SHIT,FACEBOOK,https://facebook.com/DUKISSJ/,18942524,223,Buenos Aires,AR,1511744,C,Santiago,CL,1157789,RM,Madrid,ES,1145750,M,Mexico City,MX,1002023,CMX,Lima,PE,715819,LMA
Quevedo,"Pedro Domínguez Quevedo (PDQ) aka <a href=""spotify:artist:52iwsT98xCoGgiGntTiR7K"" data-name=""Quevedo"">Quevedo</a>, desde Las Palmas de Gran Canaria. [LPGCYK] CANARIAS TA&#39; EN LA CASA MAMII #ALBUMMODE
 
INCOMPRENDI2 Est. 202* // Qx?",INSTAGRAM,https://instagram.com/quevedo.pd/,32111735,76,Mexico City,MX,1920751,CMX,Madrid,ES,1890672,M,Santiago,CL,1698725,RM,Buenos Aires,AR,1527775,C,Barcelona,ES,960255,B
